<?xml version="1.0"?>
<!DOCTYPE Report
[
<!ELEMENT Report (General ,(Doc|BPT)) >
<!ATTLIST Report ver CDATA #REQUIRED tmZone CDATA #REQUIRED>

<!ELEMENT General ( DocLocation ) >
<!ATTLIST General productName CDATA #REQUIRED productVer CDATA #REQUIRED os CDATA #REQUIRED host CDATA #REQUIRED qcserver CDATA #IMPLIED qcproject CDATA #IMPLIED SolManSolutionId CDATA #IMPLIED SolManProjectId CDATA #IMPLIED SolManTestPlanId CDATA #IMPLIED SolManTestPackageId CDATA #IMPLIED SolManUserInfoData CDATA #IMPLIED  >

<!ELEMENT BPT (DName,Res,DVer?,TSet?,TInst?,NodeArgs,AdditionalInfo*,Doc*) >
<!ATTLIST BPT rID ID #REQUIRED >

<!ELEMENT Doc (DName,ConfName?,Res,DVer?,TSet?,TInst?,RunType?,DT?,AdditionalInfo*,Step*,DIter*,Step*,Action*,Doc*,Summary?,TestMaintenanceSummary*,NodeArgs?) >
<!ATTLIST Doc rID ID #REQUIRED type (Test|BC|BPTWrapperTest|Flow|Group|Action) "Test" productName CDATA #REQUIRED BCIter CDATA #IMPLIED >

<!ELEMENT RunType ( #PCDATA )>
<!ATTLIST RunType fmStep (False|True) "False" batch (False|True) "False" upDesc (False|True) "False" upChk (False|True) "False" upAS (False|True) "False">

<!ELEMENT DName ( #PCDATA ) >

<!ELEMENT ConfName ( #PCDATA ) >

<!ELEMENT Res ( #PCDATA ) >

<!ELEMENT AdditionalInfo (AdditionalDataName,AdditionalDataValue ) >

<!ELEMENT AdditionalDataName ( #PCDATA ) >

<!ELEMENT AdditionalDataValue ( #PCDATA ) >

<!ELEMENT DVer ( #PCDATA ) >

<!ELEMENT TSet ( #PCDATA ) >

<!ELEMENT TInst ( #PCDATA ) >

<!ELEMENT DIter (Step*,Action+,Summary?,NodeArgs)>
<!ATTLIST DIter rID ID #REQUIRED iterID CDATA #REQUIRED>

<!ELEMENT DocLocation ( #PCDATA )>

<!ELEMENT Action (AName,AIter*,(Step|HtmlStep|Action)*, Summary,ActionMaintenanceSummary*, NodeArgs ) >
<!ATTLIST Action rID ID #REQUIRED>

<!ELEMENT AIter ((Step|HtmlStep|Action)*,DataMapping?, Summary?,NodeArgs) >
<!ATTLIST AIter rID ID #REQUIRED iterID CDATA #REQUIRED isCountable (False|True) "False" >

<!ELEMENT AName ( #PCDATA ) >

<!ELEMENT TestMaintenanceSummary (ActionMaintenanceSummary*) >
<!ATTLIST TestMaintenanceSummary ObjectsAdded CDATA #REQUIRED ObjectsUpdated CDATA #REQUIRED StepsUpdated CDATA #REQUIRED StepsComments CDATA #REQUIRED><!ELEMENT ActionMaintenanceSummary (ObjectChange* ) >
<!ATTLIST ActionMaintenanceSummary Action CDATA #REQUIRED Objects CDATA #REQUIRED Updated CDATA #REQUIRED LinesTotal CDATA #REQUIRED Added CDATA #REQUIRED LinesUpdated CDATA #REQUIRED>

<!ELEMENT ObjectChange  (Hierarchy, PropertyChangeList* ) >
<!ATTLIST ObjectChange Operation CDATA #IMPLIED OriginalRepository CDATA #IMPLIED>

<!ELEMENT PropertyChangeList (PropertyDef*) >

<!ELEMENT PropertyDef (OriginalValue, NewValue) >
<!ATTLIST PropertyDef PropName CDATA #REQUIRED OriginRegularExpression (True|False) "False" NewRegularExpression (True|False) "False" AddedProperty (True|False) "False" >

<!ELEMENT OriginalValue ( #PCDATA )>

<!ELEMENT NewValue ( #PCDATA )>

<!ELEMENT Hierarchy  (ObjectName, Hierarchy*) >
<!ATTLIST Hierarchy MicClass CDATA #REQUIRED>

<!ELEMENT ObjectName  ( #PCDATA ) >

<!ELEMENT Step (Obj,Details,Time,TimeTick* ,(Step|HtmlStep|Doc)*, DataMapping?, NodeArgs) >
<!ATTLIST Step rID ID #REQUIRED retval CDATA #IMPLIED>

<!ELEMENT HtmlStep (HTML,TimeTick*,(Step|HtmlStep|Doc)*,NodeArgs) >
<!ATTLIST HtmlStep rID ID #REQUIRED >

<!ELEMENT Obj ( #PCDATA ) >
<!ATTLIST Obj plainTxt (False|True) "True">

<!ELEMENT Details ( #PCDATA ) >
<!ATTLIST Details plainTxt (False|True) "True">

<!ELEMENT Time ( #PCDATA ) >

<!ELEMENT HTML ( #PCDATA ) >

<!ELEMENT Disp ( #PCDATA ) >

<!ELEMENT TimeTick ( #PCDATA ) >

<!ELEMENT DataMapping ( DataMappedItem* )>
<!ELEMENT DataMappedItem EMPTY >
<!ATTLIST DataMappedItem dsName CDATA #REQUIRED >
<!ATTLIST DataMappedItem rowId CDATA #REQUIRED >

<!ELEMENT NodeArgs (Disp,TopPane?,BtmPane?,ExtendedInfo? )>
<!ATTLIST NodeArgs eType CDATA #REQUIRED icon CDATA #REQUIRED nRep CDATA #REQUIRED UserNote CDATA #IMPLIED filter (False|True) "True">
<!ATTLIST NodeArgs status (Passed|Failed|Done|Warning|Information) "Done">
<!ATTLIST NodeArgs iconSel CDATA #IMPLIED nType CDATA #IMPLIED MovieMarker CDATA "">
<!ATTLIST NodeArgs Source CDATA #IMPLIED SourceLine CDATA #IMPLIED StepFlowItemKey CDATA #IMPLIED >

<!ELEMENT TopPane (Path)>

<!ELEMENT BtmPane ( (Path|WR)?,ASHilite?)>
<!ATTLIST BtmPane vType CDATA "HTML">

<!ELEMENT Path ( #PCDATA ) >

<!ELEMENT ASHilite ( #PCDATA ) >

<!ELEMENT WR ( #PCDATA ) >

<!ELEMENT ExtendedInfo ( StepData ) >

<!ATTLIST ExtendedInfo StepType CDATA #REQUIRED>
<!ELEMENT DT (NodeArgs) >
<!ATTLIST DT rID ID #REQUIRED>

<!ELEMENT Summary (Param*)>
<!ATTLIST Summary sTime CDATA #IMPLIED eTime CDATA #IMPLIED passed CDATA #IMPLIED failed CDATA #IMPLIED warnings CDATA #IMPLIED retval CDATA #IMPLIED stopped (False|True) "False" >

<!ELEMENT Param (ParamName,ParamVal)+ >
<!ATTLIST Param paramInOut (In|Out) "In">

<!ELEMENT ParamName ( #PCDATA ) >

<!ELEMENT ParamVal ( #PCDATA ) >

]
>
<Report ver="2.0" tmZone="India Standard Time">
<General productName="HP Unified Functional Testing" productVer="12.52" os="Windows 7" host="XIN009OL20QWH"><DocLocation><![CDATA[C:\IDBPM_UFT\Test_Scripts\Disco_Create_Claim_BuildAIP_CompleteTask]]></DocLocation></General>
<Doc rID="T1"   productName= "HP Unified Functional Testing"  >
<DName><![CDATA[Disco_Create_Claim_BuildAIP_CompleteTask]]></DName>
<Res><![CDATA[Res1]]></Res>
<DT rID="T2">
<NodeArgs eType="Table" icon="2" nRep="4" filter="False" >
<Disp><![CDATA[Run-Time Data Table]]></Disp>
<BtmPane vType="Table" >
<Path><![CDATA[Default.xls]]></Path>
</BtmPane>
</NodeArgs>
</DT>
<DIter rID="T3" iterID="1" >
<Action rID="T4">
<AName><![CDATA[BeginTest]]></AName>
<Action rID="T5">
<AName><![CDATA[OpenChrome&URL]]></AName>
<Step rID="T6">
<Obj plainTxt="False" ><![CDATA[SystemUtil]]></Obj>
<Details plainTxt="False" ><![CDATA[SystemUtil]]></Details>
<Time><![CDATA[1/31/2018 - 12:25:51]]></Time>
<TimeTick>1517381751</TimeTick>
<Step rID="T7">
<Obj plainTxt="False" ><![CDATA[Run "Chrome",1]]></Obj>
<Details plainTxt="False" ><![CDATA[Run "Chrome",1]]></Details>
<Time><![CDATA[1/31/2018 - 12:25:51]]></Time>
<TimeTick>1517381751</TimeTick>
<NodeArgs eType="Replay" icon="5" nRep="12" status="Passed" Source="OpenChrome&amp;URL" SourceLine="-1" >
<Disp><![CDATA[Run "Chrome",1]]></Disp>
</NodeArgs>
</Step>
<NodeArgs eType="Replay" icon="5" nRep="11" status="Passed" Source="OpenChrome&amp;URL" SourceLine="-1" >
<Disp><![CDATA[SystemUtil]]></Disp>
</NodeArgs>
</Step>
<Step rID="T8">
<Obj plainTxt="False" ><![CDATA[BPM Console]]></Obj>
<Details plainTxt="False" ><![CDATA[Browser]]></Details>
<Time><![CDATA[1/31/2018 - 12:26:00]]></Time>
<TimeTick>1517381760</TimeTick>
<Step rID="T9">
<Obj plainTxt="False" ><![CDATA[InsightObject.Click]]></Obj>
<Details plainTxt="False" ><![CDATA[]]></Details>
<Time><![CDATA[1/31/2018 - 12:26:00]]></Time>
<TimeTick>1517381760</TimeTick>
<NodeArgs eType="Replay" icon="7" nRep="15" Source="OpenChrome&amp;URL" SourceLine="-1" >
<Disp><![CDATA[InsightObject.Click]]></Disp>
</NodeArgs>
</Step>
<NodeArgs eType="Context" icon="6" nRep="14" Source="OpenChrome&amp;URL" SourceLine="-1" >
<Disp><![CDATA[BPM Console]]></Disp>
</NodeArgs>
</Step>
<Summary sTime="1/31/2018 - 12:25:49" eTime="1/31/2018 - 12:26:00" passed="1" failed="0" warnings="0" ></Summary>
<NodeArgs eType="StartAction" icon="4" nRep="8" status="Passed" >
<Disp><![CDATA[OpenChrome&URL Summary]]></Disp>
</NodeArgs>
</Action>
<Action rID="T10">
<AName><![CDATA[LoginBPM]]></AName>
<Step rID="T11">
<Obj plainTxt="False" ><![CDATA[[ Username ].Set]]></Obj>
<Details plainTxt="False" ><![CDATA[""]]></Details>
<Time><![CDATA[1/31/2018 - 12:26:01]]></Time>
<TimeTick>1517381761</TimeTick>
<NodeArgs eType="Replay" icon="8" nRep="20" Source="LoginBPM" SourceLine="-1" >
<Disp><![CDATA[[ Username ].Set]]></Disp>
</NodeArgs>
</Step>
<Step rID="T12">
<Obj plainTxt="False" ><![CDATA[[ Username ].Set]]></Obj>
<Details plainTxt="False" ><![CDATA["pvutla"]]></Details>
<Time><![CDATA[1/31/2018 - 12:26:02]]></Time>
<TimeTick>1517381762</TimeTick>
<NodeArgs eType="Replay" icon="8" nRep="23" Source="LoginBPM" SourceLine="-1" >
<Disp><![CDATA[[ Username ].Set]]></Disp>
</NodeArgs>
</Step>
<Step rID="T13">
<Obj plainTxt="False" ><![CDATA[[ Password ].Set]]></Obj>
<Details plainTxt="False" ><![CDATA[""]]></Details>
<Time><![CDATA[1/31/2018 - 12:26:02]]></Time>
<TimeTick>1517381762</TimeTick>
<NodeArgs eType="Replay" icon="8" nRep="26" Source="LoginBPM" SourceLine="-1" >
<Disp><![CDATA[[ Password ].Set]]></Disp>
</NodeArgs>
</Step>
<Step rID="T14">
<Obj plainTxt="False" ><![CDATA[[ Password ].SetSecure]]></Obj>
<Details plainTxt="False" ><![CDATA["5a5b5cd3d3aeb1aaff2166463fc2fb473451835de656"]]></Details>
<Time><![CDATA[1/31/2018 - 12:26:02]]></Time>
<TimeTick>1517381762</TimeTick>
<NodeArgs eType="Replay" icon="8" nRep="29" Source="LoginBPM" SourceLine="-1" >
<Disp><![CDATA[[ Password ].SetSecure]]></Disp>
</NodeArgs>
</Step>
<Step rID="T15">
<Obj plainTxt="False" ><![CDATA[[ login_signin_button ].Click]]></Obj>
<Details plainTxt="False" ><![CDATA[]]></Details>
<Time><![CDATA[1/31/2018 - 12:26:03]]></Time>
<TimeTick>1517381763</TimeTick>
<NodeArgs eType="Replay" icon="9" nRep="32" Source="LoginBPM" SourceLine="-1" >
<Disp><![CDATA[[ login_signin_button ].Click]]></Disp>
</NodeArgs>
</Step>
<Step rID="T16">
<Obj plainTxt="False" ><![CDATA[[ WebElement ].Exist]]></Obj>
<Details plainTxt="False" ><![CDATA["Object exists"]]></Details>
<Time><![CDATA[1/31/2018 - 12:26:04]]></Time>
<TimeTick>1517381764</TimeTick>
<NodeArgs eType="Replay" icon="10" nRep="39" Source="LoginBPM" SourceLine="-1" >
<Disp><![CDATA[[ WebElement ].Exist]]></Disp>
</NodeArgs>
</Step>
<Step rID="T17">
<Obj plainTxt="False" ><![CDATA[[ Disco ].Exist]]></Obj>
<Details plainTxt="False" ><![CDATA["Object exists"]]></Details>
<Time><![CDATA[1/31/2018 - 12:26:25]]></Time>
<TimeTick>1517381785</TimeTick>
<NodeArgs eType="Replay" icon="10" nRep="41" Source="LoginBPM" SourceLine="-1" >
<Disp><![CDATA[[ Disco ].Exist]]></Disp>
</NodeArgs>
</Step>
<Step rID="T18">
<Obj plainTxt="False" ><![CDATA[[ Disco ]]]></Obj>
<Details plainTxt="False" ><![CDATA[WebElement]]></Details>
<Time><![CDATA[1/31/2018 - 12:26:25]]></Time>
<TimeTick>1517381785</TimeTick>
<Step rID="T19">
<Obj plainTxt="False" ><![CDATA["[ Disco ]"]]></Obj>
<Details plainTxt="False" ><![CDATA[Property &quot;innertext&quot; has the expected value: &quot;Disco&quot;.]]></Details>
<Time><![CDATA[1/31/2018 - 12:26:25]]></Time>
<TimeTick>1517381785</TimeTick>
<NodeArgs eType="Replay" icon="10" nRep="44" status="Passed" nType="CheckProperty" Source="LoginBPM" SourceLine="-1" >
<Disp><![CDATA["[ Disco ]"]]></Disp>
</NodeArgs>
</Step>
<NodeArgs eType="Context" icon="10" nRep="43" status="Passed" Source="LoginBPM" SourceLine="-1" >
<Disp><![CDATA[[ Disco ]]]></Disp>
</NodeArgs>
</Step>
<Step rID="T20">
<Obj ><![CDATA[Login to BPM: Successful]]></Obj>
<Details ><![CDATA[Logged in to BPM Console]]></Details>
<Time><![CDATA[1/31/2018 - 12:26:50]]></Time>
<TimeTick>1517381810</TimeTick>
<NodeArgs eType="User" icon="11" nRep="45" status="Passed" Source="LoginBPM" SourceLine="-1" >
<Disp><![CDATA[Login to BPM: Successful]]></Disp>
</NodeArgs>
</Step>
<Summary sTime="1/31/2018 - 12:26:00" eTime="1/31/2018 - 12:26:50" passed="2" failed="0" warnings="0" ></Summary>
<NodeArgs eType="StartAction" icon="4" nRep="17" status="Passed" >
<Disp><![CDATA[LoginBPM Summary]]></Disp>
</NodeArgs>
</Action>
<Action rID="T21">
<AName><![CDATA[CreateDisconnectTask]]></AName>
<Step rID="T22">
<Obj plainTxt="False" ><![CDATA[[ createNewDisconnectRequestButton ].Click]]></Obj>
<Details plainTxt="False" ><![CDATA[]]></Details>
<Time><![CDATA[1/31/2018 - 12:26:52]]></Time>
<TimeTick>1517381812</TimeTick>
<NodeArgs eType="Replay" icon="9" nRep="50" Source="CreateDisconnectTask" SourceLine="-1" >
<Disp><![CDATA[[ createNewDisconnectRequestButton ].Click]]></Disp>
</NodeArgs>
</Step>
<Step rID="T23">
<Obj plainTxt="False" ><![CDATA[[ WebElement ].Exist]]></Obj>
<Details plainTxt="False" ><![CDATA["Object does not exist"]]></Details>
<Time><![CDATA[1/31/2018 - 12:27:02]]></Time>
<TimeTick>1517381822</TimeTick>
<NodeArgs eType="Replay" icon="10" nRep="67" Source="CreateDisconnectTask" SourceLine="-1" >
<Disp><![CDATA[[ WebElement ].Exist]]></Disp>
</NodeArgs>
</Step>
<Step rID="T24">
<Obj plainTxt="False" ><![CDATA[[ New Disconnect Request ].WaitProperty]]></Obj>
<Details plainTxt="False" ><![CDATA["innertext", "New Disconnect Request", "New Disconnect Request", 1000]]></Details>
<Time><![CDATA[1/31/2018 - 12:27:03]]></Time>
<TimeTick>1517381823</TimeTick>
<NodeArgs eType="Replay" icon="10" nRep="70" Source="CreateDisconnectTask" SourceLine="-1" >
<Disp><![CDATA[[ New Disconnect Request ].WaitProperty]]></Disp>
</NodeArgs>
</Step>
<Step rID="T25">
<Obj plainTxt="False" ><![CDATA[[ New Disconnect Request ]]]></Obj>
<Details plainTxt="False" ><![CDATA[WebElement]]></Details>
<Time><![CDATA[1/31/2018 - 12:27:03]]></Time>
<TimeTick>1517381823</TimeTick>
<Step rID="T26">
<Obj plainTxt="False" ><![CDATA["[ New Disconnect Request ]"]]></Obj>
<Details plainTxt="False" ><![CDATA[Property &quot;innertext&quot; has the expected value: &quot;New Disconnect Request&quot;.]]></Details>
<Time><![CDATA[1/31/2018 - 12:27:03]]></Time>
<TimeTick>1517381823</TimeTick>
<NodeArgs eType="Replay" icon="10" nRep="73" status="Passed" nType="CheckProperty" Source="CreateDisconnectTask" SourceLine="-1" >
<Disp><![CDATA["[ New Disconnect Request ]"]]></Disp>
</NodeArgs>
</Step>
<NodeArgs eType="Context" icon="10" nRep="72" status="Passed" Source="CreateDisconnectTask" SourceLine="-1" >
<Disp><![CDATA[[ New Disconnect Request ]]]></Disp>
</NodeArgs>
</Step>
<Step rID="T27">
<Obj plainTxt="False" ><![CDATA[[ Customer Id* ].Set]]></Obj>
<Details plainTxt="False" ><![CDATA["603107"]]></Details>
<Time><![CDATA[1/31/2018 - 12:27:04]]></Time>
<TimeTick>1517381824</TimeTick>
<NodeArgs eType="Replay" icon="8" nRep="76" Source="CreateDisconnectTask" SourceLine="-1" >
<Disp><![CDATA[[ Customer Id* ].Set]]></Disp>
</NodeArgs>
</Step>
<Step rID="T28">
<Obj plainTxt="False" ><![CDATA[[ Customer Name* ].Set]]></Obj>
<Details plainTxt="False" ><![CDATA["AutoM Integration Testing"]]></Details>
<Time><![CDATA[1/31/2018 - 12:27:04]]></Time>
<TimeTick>1517381824</TimeTick>
<NodeArgs eType="Replay" icon="8" nRep="79" Source="CreateDisconnectTask" SourceLine="-1" >
<Disp><![CDATA[[ Customer Name* ].Set]]></Disp>
</NodeArgs>
</Step>
<Step rID="T29">
<Obj plainTxt="False" ><![CDATA[[ customer Number* ].Set]]></Obj>
<Details plainTxt="False" ><![CDATA["603107"]]></Details>
<Time><![CDATA[1/31/2018 - 12:27:05]]></Time>
<TimeTick>1517381825</TimeTick>
<NodeArgs eType="Replay" icon="8" nRep="82" Source="CreateDisconnectTask" SourceLine="-1" >
<Disp><![CDATA[[ customer Number* ].Set]]></Disp>
</NodeArgs>
</Step>
<Step rID="T30">
<Obj plainTxt="False" ><![CDATA[[ Disconnect Date* ].Set]]></Obj>
<Details plainTxt="False" ><![CDATA["1/31/2018"]]></Details>
<Time><![CDATA[1/31/2018 - 12:27:05]]></Time>
<TimeTick>1517381825</TimeTick>
<NodeArgs eType="Replay" icon="8" nRep="85" Source="CreateDisconnectTask" SourceLine="-1" >
<Disp><![CDATA[[ Disconnect Date* ].Set]]></Disp>
</NodeArgs>
</Step>
<Step rID="T31">
<Obj plainTxt="False" ><![CDATA[[ Disconnect Reason* ].Set]]></Obj>
<Details plainTxt="False" ><![CDATA["AutoM Testing"]]></Details>
<Time><![CDATA[1/31/2018 - 12:27:06]]></Time>
<TimeTick>1517381826</TimeTick>
<NodeArgs eType="Replay" icon="8" nRep="88" Source="CreateDisconnectTask" SourceLine="-1" >
<Disp><![CDATA[[ Disconnect Reason* ].Set]]></Disp>
</NodeArgs>
</Step>
<Step rID="T32">
<Obj plainTxt="False" ><![CDATA[[ Disconnect Type* ].Set]]></Obj>
<Details plainTxt="False" ><![CDATA["Internal Billing"]]></Details>
<Time><![CDATA[1/31/2018 - 12:27:06]]></Time>
<TimeTick>1517381826</TimeTick>
<NodeArgs eType="Replay" icon="8" nRep="91" Source="CreateDisconnectTask" SourceLine="-1" >
<Disp><![CDATA[[ Disconnect Type* ].Set]]></Disp>
</NodeArgs>
</Step>
<Step rID="T33">
<Obj plainTxt="False" ><![CDATA[[ Main Contact Email* ].Set]]></Obj>
<Details plainTxt="False" ><![CDATA["pvutla@centurylink.com"]]></Details>
<Time><![CDATA[1/31/2018 - 12:27:06]]></Time>
<TimeTick>1517381826</TimeTick>
<NodeArgs eType="Replay" icon="8" nRep="94" Source="CreateDisconnectTask" SourceLine="-1" >
<Disp><![CDATA[[ Main Contact Email* ].Set]]></Disp>
</NodeArgs>
</Step>
<Step rID="T34">
<Obj plainTxt="False" ><![CDATA[[ Main Contact Name* ].Set]]></Obj>
<Details plainTxt="False" ><![CDATA["PVUTLA"]]></Details>
<Time><![CDATA[1/31/2018 - 12:27:07]]></Time>
<TimeTick>1517381827</TimeTick>
<NodeArgs eType="Replay" icon="8" nRep="97" Source="CreateDisconnectTask" SourceLine="-1" >
<Disp><![CDATA[[ Main Contact Name* ].Set]]></Disp>
</NodeArgs>
</Step>
<Step rID="T35">
<Obj plainTxt="False" ><![CDATA[[ Submitted By* ].Set]]></Obj>
<Details plainTxt="False" ><![CDATA["Prasanth.Vutla"]]></Details>
<Time><![CDATA[1/31/2018 - 12:27:07]]></Time>
<TimeTick>1517381827</TimeTick>
<NodeArgs eType="Replay" icon="8" nRep="100" Source="CreateDisconnectTask" SourceLine="-1" >
<Disp><![CDATA[[ Submitted By* ].Set]]></Disp>
</NodeArgs>
</Step>
<Step rID="T36">
<Obj plainTxt="False" ><![CDATA[[ Technical Contact Email ].Set]]></Obj>
<Details plainTxt="False" ><![CDATA["prasanth.vutla@centurylink.com"]]></Details>
<Time><![CDATA[1/31/2018 - 12:27:08]]></Time>
<TimeTick>1517381828</TimeTick>
<NodeArgs eType="Replay" icon="8" nRep="103" Source="CreateDisconnectTask" SourceLine="-1" >
<Disp><![CDATA[[ Technical Contact Email ].Set]]></Disp>
</NodeArgs>
</Step>
<Step rID="T37">
<Obj plainTxt="False" ><![CDATA[[ Technical Contact Name ].Set]]></Obj>
<Details plainTxt="False" ><![CDATA["QA Automation"]]></Details>
<Time><![CDATA[1/31/2018 - 12:27:08]]></Time>
<TimeTick>1517381828</TimeTick>
<NodeArgs eType="Replay" icon="8" nRep="106" Source="CreateDisconnectTask" SourceLine="-1" >
<Disp><![CDATA[[ Technical Contact Name ].Set]]></Disp>
</NodeArgs>
</Step>
<Step rID="T38">
<Obj plainTxt="False" ><![CDATA[[ WorkRequest Number* ].Set]]></Obj>
<Details plainTxt="False" ><![CDATA["687629"]]></Details>
<Time><![CDATA[1/31/2018 - 12:27:08]]></Time>
<TimeTick>1517381828</TimeTick>
<NodeArgs eType="Replay" icon="8" nRep="109" Source="CreateDisconnectTask" SourceLine="-1" >
<Disp><![CDATA[[ WorkRequest Number* ].Set]]></Disp>
</NodeArgs>
</Step>
<Step rID="T39">
<Obj plainTxt="False" ><![CDATA[[ Start ].WaitProperty]]></Obj>
<Details plainTxt="False" ><![CDATA["visible", True, True, 1000]]></Details>
<Time><![CDATA[1/31/2018 - 12:27:13]]></Time>
<TimeTick>1517381833</TimeTick>
<NodeArgs eType="Replay" icon="10" nRep="115" Source="CreateDisconnectTask" SourceLine="-1" >
<Disp><![CDATA[[ Start ].WaitProperty]]></Disp>
</NodeArgs>
</Step>
<Step rID="T40">
<Obj plainTxt="False" ><![CDATA[[ Start ]]]></Obj>
<Details plainTxt="False" ><![CDATA[WebElement]]></Details>
<Time><![CDATA[1/31/2018 - 12:27:13]]></Time>
<TimeTick>1517381833</TimeTick>
<Step rID="T41">
<Obj plainTxt="False" ><![CDATA["[ Start ]"]]></Obj>
<Details plainTxt="False" ><![CDATA[Property &quot;innertext&quot; has the expected value: &quot;Start&quot;.]]></Details>
<Time><![CDATA[1/31/2018 - 12:27:13]]></Time>
<TimeTick>1517381833</TimeTick>
<NodeArgs eType="Replay" icon="10" nRep="118" status="Passed" nType="CheckProperty" Source="CreateDisconnectTask" SourceLine="-1" >
<Disp><![CDATA["[ Start ]"]]></Disp>
</NodeArgs>
</Step>
<NodeArgs eType="Context" icon="10" nRep="117" status="Passed" Source="CreateDisconnectTask" SourceLine="-1" >
<Disp><![CDATA[[ Start ]]]></Disp>
</NodeArgs>
</Step>
<Step rID="T42">
<Obj plainTxt="False" ><![CDATA[[ Start ].Click]]></Obj>
<Details plainTxt="False" ><![CDATA[]]></Details>
<Time><![CDATA[1/31/2018 - 12:27:29]]></Time>
<TimeTick>1517381849</TimeTick>
<NodeArgs eType="Replay" icon="10" nRep="121" Source="CreateDisconnectTask" SourceLine="-1" >
<Disp><![CDATA[[ Start ].Click]]></Disp>
</NodeArgs>
</Step>
<Step rID="T43">
<Obj plainTxt="False" ><![CDATA[[ WebElement ].Exist]]></Obj>
<Details plainTxt="False" ><![CDATA["Object exists"]]></Details>
<Time><![CDATA[1/31/2018 - 12:27:29]]></Time>
<TimeTick>1517381849</TimeTick>
<NodeArgs eType="Replay" icon="10" nRep="123" Source="CreateDisconnectTask" SourceLine="-1" >
<Disp><![CDATA[[ WebElement ].Exist]]></Disp>
</NodeArgs>
</Step>
<Step rID="T44">
<Obj ><![CDATA[Disconnect Task Created - Successfully]]></Obj>
<Details ><![CDATA[Create Task Successful]]></Details>
<Time><![CDATA[1/31/2018 - 12:27:39]]></Time>
<TimeTick>1517381859</TimeTick>
<NodeArgs eType="User" icon="11" nRep="124" status="Passed" Source="CreateDisconnectTask" SourceLine="-1" >
<Disp><![CDATA[Disconnect Task Created - Successfully]]></Disp>
</NodeArgs>
</Step>
<Summary sTime="1/31/2018 - 12:26:51" eTime="1/31/2018 - 12:27:39" passed="3" failed="0" warnings="0" ></Summary>
<NodeArgs eType="StartAction" icon="4" nRep="47" status="Passed" >
<Disp><![CDATA[CreateDisconnectTask Summary]]></Disp>
</NodeArgs>
</Action>
<Action rID="T45">
<AName><![CDATA[FilterDisco_WR]]></AName>
<Step rID="T46">
<Obj plainTxt="False" ><![CDATA[[ Disco ].Click]]></Obj>
<Details plainTxt="False" ><![CDATA[]]></Details>
<Time><![CDATA[1/31/2018 - 12:27:40]]></Time>
<TimeTick>1517381860</TimeTick>
<NodeArgs eType="Replay" icon="10" nRep="129" Source="FilterDisco_WR" SourceLine="-1" >
<Disp><![CDATA[[ Disco ].Click]]></Disp>
</NodeArgs>
</Step>
<Step rID="T47">
<Obj plainTxt="False" ><![CDATA[[ WebElement ].Exist]]></Obj>
<Details plainTxt="False" ><![CDATA["Object does not exist"]]></Details>
<Time><![CDATA[1/31/2018 - 12:27:51]]></Time>
<TimeTick>1517381871</TimeTick>
<NodeArgs eType="Replay" icon="10" nRep="146" Source="FilterDisco_WR" SourceLine="-1" >
<Disp><![CDATA[[ WebElement ].Exist]]></Disp>
</NodeArgs>
</Step>
<Step rID="T48">
<Obj plainTxt="False" ><![CDATA[[ Disco ].Fire Web Event]]></Obj>
<Details plainTxt="False" ><![CDATA["onmouseup"]]></Details>
<Time><![CDATA[1/31/2018 - 12:27:51]]></Time>
<TimeTick>1517381871</TimeTick>
<NodeArgs eType="Replay" icon="10" nRep="149" Source="FilterDisco_WR" SourceLine="-1" >
<Disp><![CDATA[[ Disco ].Fire Web Event]]></Disp>
</NodeArgs>
</Step>
<Step rID="T49">
<Obj plainTxt="False" ><![CDATA[[ Disco ].Fire Web Event]]></Obj>
<Details plainTxt="False" ><![CDATA["onmouseover"]]></Details>
<Time><![CDATA[1/31/2018 - 12:27:52]]></Time>
<TimeTick>1517381872</TimeTick>
<NodeArgs eType="Replay" icon="10" nRep="152" Source="FilterDisco_WR" SourceLine="-1" >
<Disp><![CDATA[[ Disco ].Fire Web Event]]></Disp>
</NodeArgs>
</Step>
<Step rID="T50">
<Obj plainTxt="False" ><![CDATA[[ Disco ].WaitProperty]]></Obj>
<Details plainTxt="False" ><![CDATA["innertext", "Disco", "Disco", 1000]]></Details>
<Time><![CDATA[1/31/2018 - 12:28:02]]></Time>
<TimeTick>1517381882</TimeTick>
<NodeArgs eType="Replay" icon="10" nRep="155" Source="FilterDisco_WR" SourceLine="-1" >
<Disp><![CDATA[[ Disco ].WaitProperty]]></Disp>
</NodeArgs>
</Step>
<Step rID="T51">
<Obj plainTxt="False" ><![CDATA[[ Disco ]]]></Obj>
<Details plainTxt="False" ><![CDATA[WebElement]]></Details>
<Time><![CDATA[1/31/2018 - 12:28:02]]></Time>
<TimeTick>1517381882</TimeTick>
<Step rID="T52">
<Obj plainTxt="False" ><![CDATA["[ Disco ]"]]></Obj>
<Details plainTxt="False" ><![CDATA[Property &quot;innertext&quot; has the expected value: &quot;Disco&quot;.]]></Details>
<Time><![CDATA[1/31/2018 - 12:28:02]]></Time>
<TimeTick>1517381882</TimeTick>
<NodeArgs eType="Replay" icon="10" nRep="158" status="Passed" nType="CheckProperty" Source="FilterDisco_WR" SourceLine="-1" >
<Disp><![CDATA["[ Disco ]"]]></Disp>
</NodeArgs>
</Step>
<NodeArgs eType="Context" icon="10" nRep="157" status="Passed" Source="FilterDisco_WR" SourceLine="-1" >
<Disp><![CDATA[[ Disco ]]]></Disp>
</NodeArgs>
</Step>
<Step rID="T53">
<Obj plainTxt="False" ><![CDATA[[ filterButton ].Fire Web Event]]></Obj>
<Details plainTxt="False" ><![CDATA["onmouseover"]]></Details>
<Time><![CDATA[1/31/2018 - 12:28:04]]></Time>
<TimeTick>1517381884</TimeTick>
<NodeArgs eType="Replay" icon="9" nRep="162" Source="FilterDisco_WR" SourceLine="-1" >
<Disp><![CDATA[[ filterButton ].Fire Web Event]]></Disp>
</NodeArgs>
</Step>
<Step rID="T54">
<Obj plainTxt="False" ><![CDATA[[ filterButton ].Click]]></Obj>
<Details plainTxt="False" ><![CDATA[]]></Details>
<Time><![CDATA[1/31/2018 - 12:28:17]]></Time>
<TimeTick>1517381897</TimeTick>
<NodeArgs eType="Replay" icon="9" nRep="166" Source="FilterDisco_WR" SourceLine="-1" >
<Disp><![CDATA[[ filterButton ].Click]]></Disp>
</NodeArgs>
</Step>
<Step rID="T55">
<Obj plainTxt="False" ><![CDATA[[ Disco ].Fire Web Event]]></Obj>
<Details plainTxt="False" ><![CDATA["onmouseover"]]></Details>
<Time><![CDATA[1/31/2018 - 12:28:22]]></Time>
<TimeTick>1517381902</TimeTick>
<NodeArgs eType="Replay" icon="10" nRep="169" Source="FilterDisco_WR" SourceLine="-1" >
<Disp><![CDATA[[ Disco ].Fire Web Event]]></Disp>
</NodeArgs>
</Step>
<Step rID="T56">
<Obj plainTxt="False" ><![CDATA[[ filter-field-select ].Click]]></Obj>
<Details plainTxt="False" ><![CDATA[]]></Details>
<Time><![CDATA[1/31/2018 - 12:28:23]]></Time>
<TimeTick>1517381903</TimeTick>
<NodeArgs eType="Replay" icon="10" nRep="172" Source="FilterDisco_WR" SourceLine="-1" >
<Disp><![CDATA[[ filter-field-select ].Click]]></Disp>
</NodeArgs>
</Step>
<Step rID="T57">
<Obj plainTxt="False" ><![CDATA[[ WebButton ].Click]]></Obj>
<Details plainTxt="False" ><![CDATA[]]></Details>
<Time><![CDATA[1/31/2018 - 12:28:23]]></Time>
<TimeTick>1517381903</TimeTick>
<NodeArgs eType="Replay" icon="9" nRep="175" Source="FilterDisco_WR" SourceLine="-1" >
<Disp><![CDATA[[ WebButton ].Click]]></Disp>
</NodeArgs>
</Step>
<Step rID="T58">
<Obj plainTxt="False" ><![CDATA[[ Next ].Click]]></Obj>
<Details plainTxt="False" ><![CDATA[]]></Details>
<Time><![CDATA[1/31/2018 - 12:28:25]]></Time>
<TimeTick>1517381905</TimeTick>
<NodeArgs eType="Replay" icon="10" nRep="178" Source="FilterDisco_WR" SourceLine="-1" >
<Disp><![CDATA[[ Next ].Click]]></Disp>
</NodeArgs>
</Step>
<Step rID="T59">
<Obj plainTxt="False" ><![CDATA[[ Submitted By ].Fire Web Event]]></Obj>
<Details plainTxt="False" ><![CDATA["onmouseover"]]></Details>
<Time><![CDATA[1/31/2018 - 12:28:32]]></Time>
<TimeTick>1517381912</TimeTick>
<NodeArgs eType="Replay" icon="12" nRep="182" Source="FilterDisco_WR" SourceLine="-1" >
<Disp><![CDATA[[ Submitted By ].Fire Web Event]]></Disp>
</NodeArgs>
</Step>
<Step rID="T60">
<Obj plainTxt="False" ><![CDATA[[ WorkRequest Number ].Click]]></Obj>
<Details plainTxt="False" ><![CDATA[]]></Details>
<Time><![CDATA[1/31/2018 - 12:28:33]]></Time>
<TimeTick>1517381913</TimeTick>
<NodeArgs eType="Replay" icon="10" nRep="185" Source="FilterDisco_WR" SourceLine="-1" >
<Disp><![CDATA[[ WorkRequest Number ].Click]]></Disp>
</NodeArgs>
</Step>
<Step rID="T61">
<Obj plainTxt="False" ><![CDATA[[ filter-operator-select ].Click]]></Obj>
<Details plainTxt="False" ><![CDATA[]]></Details>
<Time><![CDATA[1/31/2018 - 12:28:38]]></Time>
<TimeTick>1517381918</TimeTick>
<NodeArgs eType="Replay" icon="10" nRep="188" Source="FilterDisco_WR" SourceLine="-1" >
<Disp><![CDATA[[ filter-operator-select ].Click]]></Disp>
</NodeArgs>
</Step>
<Step rID="T62">
<Obj plainTxt="False" ><![CDATA[[ WebButton ].Click]]></Obj>
<Details plainTxt="False" ><![CDATA[]]></Details>
<Time><![CDATA[1/31/2018 - 12:28:39]]></Time>
<TimeTick>1517381919</TimeTick>
<NodeArgs eType="Replay" icon="9" nRep="191" Source="FilterDisco_WR" SourceLine="-1" >
<Disp><![CDATA[[ WebButton ].Click]]></Disp>
</NodeArgs>
</Step>
<Step rID="T63">
<Obj plainTxt="False" ><![CDATA[[ Prev equalsnot equalis greater thanis less thanis not emptyis emptyNext1-6/6 ].Fire Web Event]]></Obj>
<Details plainTxt="False" ><![CDATA["onmouseover"]]></Details>
<Time><![CDATA[1/31/2018 - 12:28:46]]></Time>
<TimeTick>1517381926</TimeTick>
<NodeArgs eType="Replay" icon="10" nRep="195" Source="FilterDisco_WR" SourceLine="-1" >
<Disp><![CDATA[[ Prev equalsnot equalis greater thanis less thanis not emptyis emptyNext1-6/6 ].Fire Web Event]]></Disp>
</NodeArgs>
</Step>
<Step rID="T64">
<Obj plainTxt="False" ><![CDATA[[ equals ].Click]]></Obj>
<Details plainTxt="False" ><![CDATA[]]></Details>
<Time><![CDATA[1/31/2018 - 12:28:47]]></Time>
<TimeTick>1517381927</TimeTick>
<NodeArgs eType="Replay" icon="10" nRep="198" Source="FilterDisco_WR" SourceLine="-1" >
<Disp><![CDATA[[ equals ].Click]]></Disp>
</NodeArgs>
</Step>
<Step rID="T65">
<Obj plainTxt="False" ><![CDATA[[ WebEdit ].Set]]></Obj>
<Details plainTxt="False" ><![CDATA["687629"]]></Details>
<Time><![CDATA[1/31/2018 - 12:28:53]]></Time>
<TimeTick>1517381933</TimeTick>
<NodeArgs eType="Replay" icon="8" nRep="201" Source="FilterDisco_WR" SourceLine="-1" >
<Disp><![CDATA[[ WebEdit ].Set]]></Disp>
</NodeArgs>
</Step>
<Step rID="T66">
<Obj plainTxt="False" ><![CDATA[[ Add ].Click]]></Obj>
<Details plainTxt="False" ><![CDATA[]]></Details>
<Time><![CDATA[1/31/2018 - 12:28:53]]></Time>
<TimeTick>1517381933</TimeTick>
<NodeArgs eType="Replay" icon="10" nRep="204" Source="FilterDisco_WR" SourceLine="-1" >
<Disp><![CDATA[[ Add ].Click]]></Disp>
</NodeArgs>
</Step>
<Step rID="T67">
<Obj plainTxt="False" ><![CDATA[[ WorkRequest Number equals "687629" ].Exist]]></Obj>
<Details plainTxt="False" ><![CDATA["Object exists"]]></Details>
<Time><![CDATA[1/31/2018 - 12:29:05]]></Time>
<TimeTick>1517381945</TimeTick>
<NodeArgs eType="Replay" icon="10" nRep="207" Source="FilterDisco_WR" SourceLine="-1" >
<Disp><![CDATA[[ WorkRequest Number equals "687629" ].Exist]]></Disp>
</NodeArgs>
</Step>
<Step rID="T68">
<Obj ><![CDATA[Apply Filter - Sucessful]]></Obj>
<Details ><![CDATA[Filter Applied]]></Details>
<Time><![CDATA[1/31/2018 - 12:29:05]]></Time>
<TimeTick>1517381945</TimeTick>
<NodeArgs eType="User" icon="11" nRep="208" status="Passed" Source="FilterDisco_WR" SourceLine="-1" >
<Disp><![CDATA[Apply Filter - Sucessful]]></Disp>
</NodeArgs>
</Step>
<Summary sTime="1/31/2018 - 12:27:39" eTime="1/31/2018 - 12:29:06" passed="2" failed="0" warnings="0" ></Summary>